{
  "component_id": "distilbert-amd",
  "description": "AMD 125 DistilBERT training collector.",
  "overlay": [
    "scripts/collect_workload.py"
  ],
  "selectors": [
    {
      "field": "Workload Name",
      "operator": "equals",
      "value": "DistilBERT NLP Training Baseline"
    },
    {
      "field": "GPU Vendor",
      "operator": "equals",
      "value": "AMD"
    }
  ],
  "role": "collector",
  "completeness": "thin",
  "provides": [
    "scripts/collect_workload.py"
  ],
  "does_not_provide": []
}
