{
  "component_id": "linpack-hpl-nvidia",
  "description": "NVIDIA 220/420 single-GPU FP64 Linpack via cuSOLVER GETRF/GETRS. size_t host allocations. Clamps N>=65536 to 32768. Residual must pass. Does not invent 10 TFLOPS.",
  "overlay": [
    "src/nvhpl.cu",
    "scripts/build.sh",
    "scripts/collect_workload.py"
  ],
  "selectors": [
    {
      "field": "Workload Name",
      "operator": "equals",
      "value": "NVIDIA HPL FP64 (High Performance Linpack)"
    },
    {
      "field": "GPU Vendor",
      "operator": "equals",
      "value": "NVIDIA"
    }
  ],
  "role": "collector",
  "completeness": "closed",
  "provides": [
    "src/nvhpl.cu",
    "scripts/build.sh",
    "scripts/collect_workload.py"
  ],
  "does_not_provide": []
}
