{
  "component_id": "rag-faiss-end2end-nvidia",
  "description": "Real squad_v2 + FAISS + BGE + Mistral-7B RAG runner for NVIDIA 232/432.",
  "overlay": [
    "scripts/collect_workload.py",
    "scripts/gpu-bench-rag-faiss-end2end.py",
    "scripts/prefetch_rag_models.py",
    "scripts/rag_model_paths.py",
    "scripts/install_rag_nvidia.sh"
  ],
  "selectors": [
    {
      "field": "Workload Name",
      "operator": "equals",
      "value": "RAG Pipeline Sweep"
    },
    {
      "field": "GPU Vendor",
      "operator": "equals",
      "value": "NVIDIA"
    }
  ],
  "role": "collector",
  "completeness": "closed",
  "provides": [
    "scripts/collect_workload.py",
    "scripts/gpu-bench-rag-faiss-end2end.py",
    "scripts/prefetch_rag_models.py",
    "scripts/rag_model_paths.py",
    "scripts/install_rag_nvidia.sh"
  ],
  "does_not_provide": []
}
